"season","main_character_script"
"5","Sheldon: Hmm. (Looks outside office door. Corridor lamp sparks and goes out. Corridor is bathed in an eerie glow) All right, all right. I see what’s going on. A little pre-Halloween hijinkery. A ghostly moan, a rattling of chains, a witch’s cackle. The trifecta of haunted house clichés. Instead of eek, I say yawn."
"5","Ghostly voice: Sheldon."
"5","Sheldon: Oh, the walls are dripping blood, which looks nothing like a phenolphthalein indicator exposed to a sodium carbonate solution. (Reading message on wall) See you in hell Sheldon. The most frightening thing about that is the missing comma. (A luminous skeleton rushes towards him) Ah. Okay, all right. That one was clever. Skeleton with phosphorous on a zip line. Come on out, merry pranksters. Take a bow."
"5","Raj: You should’ve seen your face."
"5","Sheldon: Yes, there’s nothing quite like the slightly widened eyes of mildly startled."
"5","Howard: Come on, admit it. We got you, Sheldon."
"5","Sheldon: Please, fright depends on an element of surprise. The simple fact is, because I am much smarter than you, and able to anticipate your actions, it is highly unlikely that you two rubes could ever surprise me. (Leonard creeps out behind him wearing a Star Trek Balok mask)"
"5","Raj: He’s probably right."
"5","Howard: We can’t beat him. He’s just too smart."
"5","Sheldon: Gentlemen. (Turns and sees Leonard. Screams and faints)."
"5","Howard: Who had money on faints?"
"5","Raj: I had pee his pants."
"5","Leonard: Hang on. Looks like everyone’s a winner."
"5","Credits sequence."
"5","Scene: The comic book store."
"5","Leonard: Oh. Watch out, Sheldon. This little boy Casper is a g-g-g-ghost!"
"5","Sheldon: Droll."
"5","Howard:Not as droll as a grown man passed out in a puddle of his own urine."
"5","Leonard: That was pretty droll. With a hint of ammonia."
"5","Sheldon: Yes, enjoy your japes, gentlemen. You think you’ve poked fun at a milquetoast academic. Well, you’ve forgotten one thing. I am also a son of the Lone Star state. I’m Texas through and through. And we know how to settle scores down there. If you doubt me, ask Mexico."
"5","Stuart: Hot girl, nine o’clock. Don’t everybody look at once!"
"5","Raj: What is she doing in a comic book store?"
"5","Stuart: I don’t know, she might be lost. Doesn’t matter. Watch and learn. Hi."
"5","Hot girl: Hi."
"5","Stuart: Um… it-it-it… (returns to guys) Shut up."
"5","Hot girl (to Leonard): Are you getting this Next Men?"
"5","Leonard: Uh, yeah. It’s issue number 21. First appearance of Hellboy."
"5","Hot girl: I know. I’ve been looking for it for years."
"5","Leonard: Sorry."
"5","Hot girl: Hey, if I pretended to hit on you, could I distract you enough to sneak it away?"
"5","Leonard: Yes, but you’d be using your superpowers for evil."
"5","Hot girl: Damn, I’m forbidden by my Kryptonian father to do so. I am Alice."
"5","Leonard: Leonard."
"5","Alice: You are very cute, Leonard."
"5","Leonard: Thanks. You, too. You know, go ahead and take it."
"5","Alice: No, no. No, no, I, I, I did evil. Would you be open to a trade?"
"5","Leonard: Uh, yeah, yeah, sure, I guess."
"5","Alice: Okay. Here. This is my number, call me."
"5","Leonard: Sorry, palm’s a little sweaty. What’s that word?"
"5","Alice: Alice."
"5","Leonard: Oh, right, your name. That makes more sense than penis."
"5","Alice: Later."
"5","Howard: Did we just see you pick up a girl in a comic book store?"
"5","Stuart: ‘Cause if you did, you get your picture up there on the Wall of Heroes."
"5","Leonard: No, I don’t think I picked her up. Besides, I have a girlfriend."
"5","Stuart: Doesn’t matter. This is the closest anyone’s ever come. You’re going on the wall, my friend."
"5","Scene: Entering the apartment building."
"5","Sheldon: Be sure to check the mail."
"5","Leonard: How many times are you gonna tell me? What’s with you?"
"5","Sheldon: Nothing. It’s not suspicious that I’m fixating. It’s consistent with my personality."
"5","Leonard: Right."
"5","Penny: Hey, guys."
"5","Leonard: More Halloween candy? Didn’t you just buy a bunch of it yesterday?"
"5","Penny: Oh. Yeah. That’s gone. It’s a rough month when Halloween and PMS hit at the same time."
"5","Sheldon: Leonard doesn’t have time to chat, he has to get the mail."
"5","Leonard: Will you relax? I’ll get it in a minute. Hey, how was work?"
"5","Sheldon: Open the mail!"
"5","Leonard: Excuse me. (Sheldon holds fingers in ears) A couple of circulars, nothing important."
"5","Penny: What’s with him?"
"5","Leonard: Hang on. (Sheldon opens mail box. A loud horn blows and a balloon with Leonard’s face on pops out. Sheldon faints again.) You might be from Texas, but I’m from New Jersey."
"5","Scene: The apartment. Leonard is with Alice."
"5","Leonard: Check it out. Jim Lee drew this of me two years ago at Comic Con."
"5","Alice: What are you wearing?"
"5","Leonard: Well, you know, it’s Comic Con. I’m Lion-O from ThunderCats."
"5","Alice: Wow, you must have gotten so laid."
"5","Leonard: No. But Jessica Alba did rub my furry belly."
"5","Alice: Want to see a comic I draw?"
"5","Leonard: You’re kidding. You have your own book?"
"5","Alice: Yeah. It’s kinda based on my life."
"5","Leonard: Cool. Oh, look. That’s you having sex with a guy in the top half of a Chewbacca costume. Comic Con?"
"5","Alice: You’d think, but no."
"5","Leonard: You’re very talented. This is really good. Did you do… (she kisses him.)"
"5","Alice: So, can I trade you my comic for the Hellboy?"
"5","Leonard: You can have my car."
"5","Sheldon (creeps into office carrying a box): Oh, dear. (Reaches into box, picks up a snake) Oh, dear. (Puts snake into Raj’s top drawer) Oh, dear, oh, dear. Oh, dear, oh, dear. Oh, dear. Oh, dear. Purell, Purell, Purell, Purell."
"5","Raj (entering): Good morning, Sheldon."
"5","Sheldon: It is, isn’t it? Oh, bother. Isn’t that just always the way? You go to staple something, and you’re out of staples. Gosh, I wish I’d known that earlier today when I was at Staples."
"5","Raj: You have a thing of paper clips right there."
"5","Sheldon: well, no, no, I need something more permanent to join these papers. Say, don’t you keep staples in your top desk drawer?"
"5","Raj: I don’t know. Maybe."
"5","Sheldon: Be a lamb and check."
"5","Raj: All right. (Opening drawer) Who do we have here?"
"5","Sheldon: It’s a snake. A terrifying snake."
"5","Raj: Oh, did some bad man put us in a drawer?"
"5","Sheldon: Stop talking like that. You’ve been rendered speechless by fear."
"5","Raj: Let’s go to the biology lab and find you some nice yummy mice."
"5","Sheldon: I tried to scare an Indian with a snake. Come on, Cooper. You’re better than this."
"5","Scene: Penny’s apartment. There is a knock."
"5","Penny: It’s open."
"5","Leonard: Hey, you got a minute?"
"5","Penny: Yeah, sure, come on in."
"5","Leonard: Thanks."
"5","Penny: Want some mac and cheese?"
"5","Leonard: No. Lactose. Gas."
"5","Penny: Glass of wine?"
"5","Leonard: No. Sulfites. Migraines."
"5","Penny: Okay, well, I’d offer you Halloween candy, but that’s gone. So, what’s up?"
"5","Leonard: Okay, we used to go out, right?"
"5","Penny: Oh, my God, that’s where I know you from."
"5","Leonard: I’m dealing with a situation and it’s kind of about my love life, so I know that might be weird for us to talk about, but in this area, as you know, all my other friends are just so stupid."
"5","Penny: All right, what’s going on?"
"5","Leonard: So, you’re okay talking about this?"
"5","Penny: Yes."
"5","Leonard: You’re sure it’s not weird."
"5","Penny: It’s okay."
"5","Leonard: You know what, if you ever want to talk to me about a problem in your life with a guy, then I would be fine with that."
"5","Penny: Okay, good, because there’s this one guy I used to date who’s about to be force-fed wine and cheese if he doesn’t get to the point."
"5","Leonard: Okay, uh, here it is. Is it cheating if a guy has a girlfriend…"
"5","Penny: Yeah, probably."
"5","Leonard: Come on."
"5","Penny: I’m sorry, go ahead."
"5","Leonard: I met this girl, and she’s great. We have a lot in common."
"5","Penny: Did you guys do it?"
"5","Leonard: No. We just made out a little."
"5","Penny: Oh, look at you, you bad boy. Did you tell her about Priya?"
"5","Leonard: Well, I was gonna, but there were too many tongues in my mouth."
"5","Penny: That’s gross."
"5","Leonard: Here’s the thing, I, I’m not one of those guys who sneaks around and sleeps with more than one woman."
"5","Penny: Well, good for you."
"5","Leonard: The problem is, I want to be one of those guys."
"5","Penny: So sleep with the new girl and lie to Priya."
"5","Leonard: Oh, that’s not who I am."
"5","Penny: All right, then break it off with the new girl."
"5","Leonard: Now, let’s not do anything rash. She’s really hot."
"5","Penny: If you like this girl so much, why don’t you just end things with Priya?"
"5","Leonard: Priya and I are in love. I think we could get married someday."
"5","Penny: Leonard, you’re looking for a way to sleep with both women and have everybody be happy about it."
"5","Leonard: Now we’re getting somewhere."
"5","Penny: What does your gut tell you?"
"5","Leonard: Go ask Penny; she’ll know what to do."
"5","Scene: The apartment. Sheldon is adjusting a device on his arm."
"5","Sheldon: Hello, Howard. I’ve realized that you scaring me was all in jest. Allow me to say, job well done. (Grabs his own hand. Electrocutes himself.) Perfect."
"5","Leonard: What are you doing?"
"5","Sheldon: Science. You wouldn’t understand."
"5","Leonard: Hey, well, see you. I’m going out. (Starts to go out. Doesn’t.)"
"5","Sheldon: I thought you were leaving the apartment."
"5","Leonard: Yeah, me, too. I can’t make up my mind."
"5","Sheldon: Are you concerned because the world is filled with big dogs and bullies?"
"5","Leonard: No. I’m having a moral crisis."
"5","Sheldon: Well, if it’s of any help, I’ve read all the great moral philosophers, including Dr. Seuss."
"5","Leonard: Oh, what the hell. I’m supposed to go see that girl from the comic book store, Alice, but I don’t know if I should, because I’m going out with Priya, but she’s in India."
"5","Sheldon: All right. So the topic at hand is sexual fidelity. Probably won’t be relying on Seuss here. Although One Fish, Two Fish, Red Fish, Blue Fish might be surprisingly applicable. Go on."
"5","Leonard: Well, they say at the end of your life, you regret the stuff you didn’t do more than the stuff that you did, and I’m pretty sure Alice is the stuff I want to do."
"5","Sheldon: You know, the German philosopher, Friedrich Nietzsche, believed that morality is just a fiction used by the herd of inferior human beings to hold back the few superior men."
"5","Leonard: That actually does help."
"5","Sheldon: It’s worth noting that he died of syphilis."
"5","Leonard: Screw it, I’m going."
"5","Sheldon: On your way home, will you pick up some orange juice?"
"5","Leonard: Do you mind? I’m questioning a lot of things in my life right now."
"5","Sheldon: Is one of those things your fondness for orange juice?"
"5","Leonard: No."
"5","Sheldon: Great. Tropicana, no pulp."
"5","Scene: Howard’s house. Sheldon rings the doorbell."
"5","Howard: Hey, Sheldon."
"5","Bernadette (off): Who is it?"
"5","Sheldon: It’s me, Sheldon, Mrs. Wolowitz."
"5","Howard: That’s not my mom, it’s Bernadette."
"5","Sheldon: Really? That’s very unsettling."
"5","Bernadette: Hi, Sheldon."
"5","Sheldon: Hi."
"5","Howard: What’s up?"
"5","Sheldon: It just occurred to me that I never formally congratulated you on your pending nuptials. So I hopped on the first bus and hightailed it down here to shake your hand. Put ‘er there, you old so-and-so."
"5","Howard: Well, I, I’m gonna see you at work in 12 hours, don’t you think it could have waited until then?"
"5","Sheldon: Holy smoke, why didn’t I think of that? You’re a better man than I, Howard Wolowitz. You put ‘er there, you son of a gun!"
"5","Howard: Whatever. (Takes his hand. Starts to be electrocuted) My… oh… it’s… (Clutches heart and collapses)"
"5","Bernadette: Oh, my God, Howard! What did you do?"
"5","Sheldon: It was a harmless Halloween prank. Look."
"5","Bernadette: Howard has a heart condition! You know that!"
"5","Sheldon: Well, I thought he made that up. Isn’t hypochondria a common idiosyncrasy of Jewish people?"
"5","Bernadette: This is adrenaline, we’re gonna have to inject it into his heart."
"5","Sheldon: We are?"
"5","Bernadette: You are. I’m not strong enough to get it through his chest plate, and we’ve only got one shot."
"5","Sheldon: Oh, no! I can’t!"
"5","Bernadette: Hurry! We’re running out of time!"
"5","Sheldon: Okay."
"5","Bernadette: Just do it!"
"5","Sheldon: Oh, God! One, two, three!"
"5","Howard: Trick or treat, bubbeleh."
"5","Sheldon: What? No. You mean this was all a ruse? Oh, how could I be so stu… (puts hand to forehead. Electrocutes himself)."
"5","Scene: Alice’s apartment. Alice and Leonard are kissing."
"5","Leonard: Damn it, I can’t. I can’t, I can’t do this."
"5","Alice: Uh, is it my tongue stud? ‘Cause if that freaks you out, you’re in for a real surprise later on."
"5","Leonard: No, no, no. I, I can’t do this. Believe me, I really want to."
"5","Alice: But?"
"5","Leonard: But I kind of have a girlfriend."
"5","Alice: Are you kidding?"
"5","Leonard: You’re cool with you and me just being friends, right?"
"5","Alice: I don’t believe this."
"5","Leonard: Wait, I don’t, which part?"
"5","Alice: I’m so stupid. I thought for once I’d met a good guy, but you’re just another jackass."
"5","Leonard: Oh, no, no, you have it wrong. No. I, I was going to be a jackass, but I stopped myself. I stayed a good guy, so, I’m gonna pass on the sex. But you should know, that’s not a comment on your hotness but on my goodness. That’s kind of my superpower. I’m, like, Captain Good Guy."
"5","Scene: Leonard being ejected into the corridor."
"5","Leonard: It’s okay. Did the right thing. You idiot!"
"5","Scene: The apartment. Leonard is on skype."
"5","Leonard: Hey, Priya."
"5","Priya: Hey, sweetheart. How’s it going?"
"5","Leonard: Uh, not so good. We have to talk."
"5","Priya: Oh, sounds serious. What’s up?"
"5","Leonard: Okay, uh, here it is. I met this girl and I kissed her, and I feel terrible about it. But it’s done, it’s never gonna happen again. And I am so, so sorry."
"5","Priya: Leonard, relax. It’s okay."
"5","Leonard: It is?"
"5","Priya: Yeah, these things happen. They happen to everybody."
"5","Leonard: Oh, my God, you are amazing. I mean, I don’t deserve you. Wh, what do, what do you mean everybody?"
"5","Priya: Leonard, I didn’t know if I should tell you, but I kind of cheated on you, too."
"5","Leonard: Uh, kind of?"
"5","Priya: A couple of weeks ago, I slept with my ex-boyfriend. So, I guess we both messed up a little."
"5","Leonard: No, no, I messed up a little. You messed up a lot."
"5","Priya: Well, it’s not a competition."
"5","Leonard: Oh yeah, it is, and you won. I, I, I’m, I’m sorry, I have to go. I don’t believe this."
"5","Sheldon (leaping out of the base of the sofa): Bazinga, punk. Now we’re even."
"5","Series 05 Episode 08 – The Isolation Permutation"
"5","Scene: The apartment."
"5","Penny: So, Bernadette, how goes the hunt for bridesmaid dresses?"
"5","Bernadette: Well, if you don’t mind looking like an orange traffic cone, great."
"5","Amy: Girlfriends, I have the answer to our dress problems."
"5","Bernadette: Really?"
"5","Amy: Twelve years ago, my cousin Irene and her entire family died in a horrific carbon monoxide accident the night before her wedding."
"5","Bernadette: That’s horrible."
"5","Amy: Yes and no. All those bridesmaids dresses remain unused and available to us for free. So it seems that cloud of odourless deadly gas had a silver lining after all. Check it out, still in the bags. The gowns, not the bridesmaids."
"5","Bernadette: I don’t know. Dead people’s dresses?"
"5","Penny: Yeah, and cap sleeves? U-u-uh."
"5","Amy: Uh, I was hoping you wouldn’t notice. Irene was always a slave to a good bargain when it came to clothes, and sadly as it turned out, space heaters."
"5","Sheldon: Ladies, please. These four walls once housed an intellectual salon where the mind received nourishment as well as the stomach. But through no one’s fault, Penny, the quality of dinner conversation in this apartment has declined. And again, I’m looking at no one in particular, Penny."
"5","Leonard: Fine. What would you like to talk about, Sheldon?"
"5","Howard: What would you like to talk about, Sheldon? Why do you hate us?"
"5","Sheldon: I’ve prepared a number of topics that should appeal to both the advanced and novice conversationalists."
"5","Penny: Okay, that time you looked at me."
"5","Amy: Who didn’t? Your skin is like alabaster. Do you even have pores?"
"5","Sheldon: Topic one. Faster-than-light particles at CERN, paradigm-shifting discovery or another Swiss export as full of holes as their cheese? And converse."
"5","Penny: All right, who wants to go to my apartment and look at bridal magazines?"
"5","Bernadette: Oh, me."
"5","Penny: Through no one’s fault, Sheldon, we’re leaving."
"5","Amy: Wait for moi."
"5","Sheldon: You’re leaving?"
"5","Amy: Sheldon, sometimes you forget, I’m a lady. And with that comes an oestrogen fuelled need to page through thick glossy magazines that make me hate my body."
"5","Sheldon: Ah. New topic. Women, delightfully mysterious or bat-crap crazy?"
"5","Raj: Totally. What’s wrong with cap sleeves? If you have the right figure for it, they’re adorable."
"5","Credits sequence."
"5","Scene: The cafeteria."
"5","Leonard: Hey, Amy, what brings you to our neck of the woods?"
"5","Amy: Your neurology department loaned me a culture of prions for my research on bovine spongiform encephalopathy."
"5","Sheldon: She popped by to borrow a cup of mad cow disease."
"5","Amy: It’s hard to make degenerative brain maladies hilarious, and yet somehow you do it."
"5","Howard: That’s fun to have in a lunchroom."
"5","Amy: The real fun starts when you get to pick the rat you’re going to feed it to, and maybe you choose the beady-eyed little mother who’s been biting you all week."
"5","Howard: Please, we’re eating. Can we get that off the table and change the subject?"
"5","Sheldon: Can we? Stand back while I turn this conversation into a conver-sensation."
"5","Leonard: This time, it’s your fault."
"5","Sheldon: I have 100 alphabetized topics from artichoke, come on, people, it’s just a giant thistle, to zzz, the onamona-poetry of sleep."
"5","Leonard: Amy, how long would it take for that mad cow disease to kill me?"
"5","Amy: I don’t know, four or five years."
"5","Leonard: No, it’s not gonna do it."
"5","Howard: Oy. Bernadette keeps texting me pictures of Penny in bridesmaid dresses."
"5","Amy: They’re out shopping right now?"
"5","Howard: Yeah."
"5","Amy: Just the two of them?"
"5","Howard: I guess."
"5","Amy: That’s cool, that’s cool."
"5","Howard: Why are they asking me about this stuff? What guy knows what a sweetheart neckline is? (Raj raises his hand)"
"5","Scene: The apartment. Leonard is horseracing on a Kinnect game."
"5","Leonard: Leonard’s coming down the home stretch! Come on, horsey, you can do this! Damn. Come on, thigh muscles, you can do this! Yes! First place. I would have been a great jockey if I weren’t too tall. And scared of horses. Sheldon, you’re up."
"5","Sheldon: What?"
"5","Leonard: Come on, it’s your turn. We said we’d get more fresh air."
"5","Sheldon: Sorry. I’m a little distracted. I can’t seem to get in touch with Amy. I tried e-mail, video chat, tweeting her, posting on her Facebook wall, texting her, nothing."
"5","Leonard: Did you try calling her on the telephone?"
"5","Sheldon: The telephone. You know, Leonard, in your own simple way, you may be the wisest of us all. Voice mail. Curiouser and curiouser."
"5","Leonard: If you’re worried, we can go over there and see if she’s all right."
"5","Sheldon: Okay. You know, I heard in the news a bobcat has been spotted in her neighbourhood."
"5","Leonard: I don’t think Amy was eaten by a bobcat."
"5","Sheldon: Who thinks Amy was eaten by a bobcat?"
"5","Leonard: You do?"
"5","Sheldon: Leonard, I was just mentioning an interesting local news item. Now, thanks to you, I’m worried Amy’s been eaten by a bobcat."
"5","Leonard: Forget about the bobcat."
"5","Sheldon: How can I? You won’t stop talking about it."
"5","Scene: Amy’s apartment. Amy is playing the harp."
"5","Amy (singing): Everybody hurts, sometimes everybody cries. Everybody hurts, sometimes."
"5","Sheldon (outside): She sounds weepy. I don’t like weepy. Let’s go."
"5","Leonard: Uh, she’s your friend. Step up."
"5","Leonard: (Knock, knock, knock) Amy. (Knock, knock, knock) Amy. (Knock, knock, knock) Amy. Bye."
"5","Sheldon: Where are you going?"
"5","Leonard: I’m single, I don’t need this crap."
"5","Amy: Sheldon, what are you doing here?"
"5","Sheldon: You didn’t respond to any of my electronic communications."
"5","Amy: I wanted to be alone."
"5","Sheldon: Would you like to talk about it? And keep in mind that no is a perfectly viable answer."
"5","Amy: Sheldon, my world is crumbling around me."
"5","Sheldon: Point of order. As you’re in distress, it would be customary for me to offer you a hot beverage. But I’m a guest in your home, so it would be customary for you to offer me a beverage. How do you want to proceed vis-a-vis beverages?"
"5","Amy: It doesn’t matter. Nothing matters."
"5","Sheldon: If you’d like to take your mind off what’s troubling you, uh, word on the street is a bobcat has been spotted."
"5","Amy: Penny and Bernadette went shopping for bridesmaids dresses without me."
"5","Sheldon: And that made you feel sad?"
"5","Amy: Yes."
"5","Sheldon: I knew it. Just keep going, I guess I’m good at this."
"5","Amy: It’s just, I thought they liked hanging out with me, but I guess I was fooling myself."
"5","Sheldon: When they were over here, did you fail to offer them a beverage? ‘Cause I can see how that could stick in someone’s craw."
"5","Amy: Sheldon, I’m going to ask you something, and I’d like you to keep an open mind."
"5","Sheldon: Always."
"5","Amy: At this moment, I find myself craving human intimacy and physical contact."
"5","Sheldon: Oh, boy. You know ours is a relationship of the mind."
"5","Amy: Proposal. One wild night of torrid lovemaking that soothes my soul and inflames my loins."
"5","Sheldon: Counterproposal. I will gently stroke your head and repeat, aw, who’s a good Amy."
"5","Amy: How about this? French kissing, seven minutes in heaven culminating in second base."
"5","Sheldon: Neck massage, then you get me that beverage."
"5","Amy: We cuddle. Final offer."
"5","Sheldon: Very well. Oh, boy. (They cuddle, awkwardly.)"
"5","Amy: I’m just saying, second base is right there."
"5","Raj: Mm, I’m thinking about adopting some quirky affectation, like a pipe or a monocle or a handlebar moustache."
"5","Leonard: For all those girls out there looking for the Indian Monopoly man?"
"5","Raj: This is not a safe place. You can’t share anything here."
"5","Sheldon: The two of you need to get your women in line!"
"5","Howard: What?"
"5","Sheldon: Last night I was strong-armed into an evening of harp music and spooning with an emotional Amy Farrah Fowler. This on a night that I had originally designated for solving the space-time geometry in higher-spin gravity and building my Lego Death Star. And why? Your gal pals, Penny and Bernadette, went out shopping for some wedding nonsense without Amy, an action they took with no thought or regard as to how it would affect me, the future of string theory or my Lego fun time."
"5","Howard: What do you want us to do about it?"
"5","Sheldon: You clearly weren’t listening to my topic sentence, get your women in line! You make them apologize to Amy and set things right. I am a man of science, not someone’s snuggle bunny!"
"5","Leonard: Why do I have to talk to Penny? She’s not my girlfriend."
"5","Sheldon: You invited her to lunch four years ago. Everything about her is on you, you make it so!"
"5","Leonard: Moo-shu is Penny."
"5","Penny: Thank you. Where’s Sheldon?"
"5","Leonard: Oh, he was up late last night, so I gave him an early dinner and put him to bed."
"5","Bernadette: That’s so sweet."
"5","Leonard: Yeah, but now he’s gonna be up at dawn and want to play."
"5","Howard: So, listen, guys, the reason he was up late is because he was taking care of Amy. She’s kind of upset."
"5","Penny: Why?"
"5","Leonard: Her feelings got hurt because you guys went dress shopping without her."
"5","Bernadette: I told you that would happen."
"5","Penny: Okay, look, this is her first time being a bridesmaid and she’s just getting a little crazy with it."
"5","Bernadette: She keeps on telling us stories about bridesmaid traditions in other cultures, and they’re all about getting naked and washing each other."
"5","Penny: Yeah, and she keeps trying to figure out if our cycles have synced up so we can call ourselves the Three Menstra-teers"
"5","Bernadette: We thought it would be easier to look at dresses one time without her. I feel terrible."
"5","Penny: I know. Me, too. We’ll talk to her. Hey, wait, how did she find out?"
"5","Howard: Raj did it. And he says he would do it again. Okay, I’m sorry. You sent me the picture, I wasn’t thinking."
"5","Bernadette: Oh, Howie."
"5","Howard: Well, hey, I’m usually pretty good at not blabbing. You tell me tons of stuff about these guys, and I never repeat it."
"5","Penny: What do you tell him?"
