"season","main_character_script"
"5","Leonard: All right, we gave it 45 minutes. It’s no longer funny. Let’s try something else."
"5","Sheldon: What do you propose?"
"5","Leonard: Uh, on the count of three, both of you bounce the balls as hard as you can. The highest bounce wins the office."
"5","Kripke: Oh, you are going down, Cooper."
"5","Sheldon: I don’t think so, Kripke. I’ve bounced many a rubber ball in my day."
"5","Leonard: All right, that’s enough trash talk. One, two, three."
"5","Howard: Sheldon was higher."
"5","Leonard: Congratulations, Sheldon. You win office."
"5","Sheldon: Who’s unsatisfactory in P.E. now?"
"5","Amy: Oh, what a great movie."
"5","Penny: I cannot believe you’ve never seen Grease."
"5","Amy: My mother didn’t allow me to watch it. She was afraid it might encourage me to join a gang."
"5","Bernadette: I’ve got to go. I’ve got to get up early. My company’s testing a new steroid that supposedly doesn’t shrink testicles, and the last one there has to do the measuring."
"5","Amy: I guess I should get going, too. Good night, painting Penny. Good night, real Penny."
"5","Penny: Good night, real Amy."
"5","Amy: You don’t have to say good night to painting Amy, ’cause she’s never leaving."
"5","Bernadette: Good night, real Penny."
"5","Penny: Bye."
"5","Bernadette: Good night, transvestite Penny."
"5","Penny: Ah, okay. Let us take you off the wall. Out of sight, out of mind. I wish."
"5","Amy (entering): You know, can I borrow that movie? Those singing hooligans really got my motor running."
"5","Penny: Sure, sure. Enjoy. I mean, get it back to me when you can, or, you know what, actually, you keep it. It’s just going to be my gift to you. Bye."
"5","Amy: Thank you. Wait. Where’d the painting go?"
"5","Penny: It’s right over there."
"5","Amy: Why?"
"5","Penny: I have no idea. That is weird."
"5","Amy: You hate it."
"5","Penny: No. No, no. It’s just, it’s a little big."
"5","Amy: I feel like an idiot."
"5","Penny: No, come on, you’re not an idiot. Look, just help me put it back up."
"5","Amy: Why? So you can just take it down when I leave? I don’t need your pity."
"5","Penny: Oh, Amy, come on."
"5","Amy: I’m just glad I didn’t go for the sculpture."
"5","Scene: Rothman’s office."
"5","Sheldon: Ah, the spoils. I see why victors love them."
"5","Raj: I’m happy for you, Sheldon. But I have to admit I’m going to miss sharing an office with you."
"5","Sheldon: Oh, of course you are. Feel free to drop by any time."
"5","Raj: Thank you."
"5","Sheldon: Yeah. Call first. (Pushes him out. Closes door. Rothman is standing naked behind it.)"
"5","Rothman: Oh. Hello."
"5","Sheldon: Professor Rothman. This isn’t your office any more. You’re retired."
"5","Rothman: I think the word you’re looking for is invisible."
"5","Scene: Amy’s apartment."
"5","Penny: I came to say I’m sorry."
"5","Amy: Don’t bother."
"5","Penny: Oh, Amy, please."
"5","Amy: I’m so humiliated. I sat there the whole time that we were watching Grease, thinking you liked the painting."
"5","Penny: I know."
"5","Amy: I was a fool from Summer Lovin’ to the very last rama lama lama ke ding a de dinga a dong."
"5","Penny: You’re right. You’re absolutely right. I should have been honest with you and told you the gift was too much."
"5","Amy: Yes, too much. Because our friendship is fundamentally asymmetrical. I clearly like you more than you like me."
"5","Penny: I don’t think you can put a number on how much one person likes another."
"5","Amy: I bought you a painting that’s 12 square feet in area. There’s a number."
"5","Penny: Amy, come on…"
"5","Amy: If you don’t like feet, you can try dollars. The painting set me back three grand."
"5","Penny: Three gr… Oh, my God! Look, look, Amy, all you need to know is, you are my friend and I don’t want to lose you out of my life."
"5","Amy: I’m sorry, I’m just having trouble believing you right now."
"5","Penny: Grab your hammer."
"5","Amy: No. Damage is done."
"5","Penny: Okay, look, I didn’t want to say this, but the real reason I took the painting down was because it made Bernadette very jealous."
"5","Amy: Oh, my goodness, how could I have not seen that? The painting is a constant reminder that of the three of us, she is the least cool."
"5","Penny: Yeah, th-th-th-that’s what it is, so…"
"5","Amy: You have such a good heart."
"5","Penny: Huh, I try."
"5","Amy: Come on."
"5","Penny: Well where are we going?"
"5","Amy: We’re going to go put this painting back up in your apartment."
"5","Penny: Well, what about Bernadette?"
"5","Amy: Oh, screw her. She’s just lucky we let her hang out with us."
"5","Scene: Rothman’s office. Sheldon is trying to affix paper over a fiercely blowing air vent."
"5","Leonard: What are you doing?"
"5","Sheldon: I’m trying to raise the temperature in here before my nipples tear through my shirt."
"5","Howard: Why don’t you just turn up the thermostat?"
"5","Sheldon: Aha! Good question. It turns out the thermostat for my new office isn’t in my new office. No. It’s next door, in Professor Davenport’s office, who is currently enjoying the hot flashes associated with menopause."
"5","Leonard: Why is there a hole here?"
"5","Sheldon: Why is there a hole in my new office? I’ve narrowed it down to two possibilities: There was something in the wall that someone outside the wall wanted, or the more disturbing, there was something in the wall that wanted out."
"5","Raj: Well, at least you finally got a window that opens. That’s nice."
"5","Sheldon: Is it? Listen."
"5","Raj: What, you don’t like wind chimes?"
"5","Sheldon: No, I hate them, but it gets worse. There it is."
"5","Howard: The bird?"
"5","Sheldon: Yeah, It’s completely out of tune with the wind chimes."
"5","Raj: So?"
"5","Sheldon: You don’t get it, do you? That’s a mockingbird. Mockingbirds can change their song, which means he’s out of tune on purpose. He’s mocking me. Oh dear. There it is again. Do you feel it?"
"5","Howard: The growing realization that you are one wacky bastard? Yep."
"5","Sheldon: No. The vibration. We are directly underneath the geology lab, and they’re running their confounded sieve shakers again. Hey, gravel monkeys, if you need to shake rocks, try jiggling your heads around!"
"5","Leonard: Sheldon, relax."
"5","Sheldon: How can I relax? My nervous system is being stretched out like the strings of a harp and plucked by holes and birds and wind and the low-hanging scrotum of the difficult-to-evict Professor Rothman."
"5","Leonard: If you’re not happy, why don’t you just let Kripke have the office?"
"5","Sheldon: What, and let him win? Do I look crazy to you? We’re trying to think down here, you geode-loving feldspar jockeys! (To the bird) And you, the notes are C, D, E, G and A. You pick one or I am chopping down that tree!"
"5","Penny: How’s that?"
"5","Amy: Little higher on the right."
"5","Penny: Now?"
"5","Amy: Little more. No. That’s got it."
"5","Penny: Yeah, okay. That’s, uh, that’s good."
"5","Amy: I’ll let you in on a little secret."
"5","Penny: Mm."
"5","Amy: Originally we were painted nude. But I had him add clothes, ’cause I thought it was an unnecessary challenge to our heterosexuality."
"5","Penny: Yeah, good call."
"5","Amy: But if you ever change your mind, all it would take is some warm, soapy water and a couple of sponges."
"5","Penny: You’re talking about the painting, right?"
"5","Amy: Sure."
"5","Scene: Rothman’s office. Sheldon has his head stuck in the hole in the wall."
"5","Sheldon: Help! Somebody help!"
"5","Leonard: What happened?"
"5","Sheldon: I was trying to see what was in here and my head got stuck."
"5","Leonard: Why would you do that?"
"5","Sheldon: It’s called scientific curiosity. Now go get butter."
"5","Leonard: Hang in there. I’ll be right back. (Takes out phone and takes a photo. Sits down and starts posting it online.)"
"5","Series 05 Episode 18 – The Werewolf Transformation"
"5","Scene: A barber’s shop."
"5","Leonard: I’m just gonna run to the store and get a few things. I’ll pick you up when you’re done."
"5","Sheldon: Okay. I like it a little better when you stay, but all right."
"5","Barber: Hey, Sheldon."
"5","Sheldon: Hello. I’m here for my haircut with Mr. D’Onofrio."
"5","Barber: I’m sorry, Uncle Tony’s in the hospital. He’s pretty sick."
"5","Sheldon: Oh, dear, Mr. D’Onofrio’s in the hospital. Why do these things always happen to me?"
"5","Barber: I can cut it for you."
"5","Sheldon: You’re not Mr. D’Onofrio. I get my hair cut by Mr. D’Onofrio. You believe this guy?"
"5","Leonard: Excuse us for a second. Sheldon, it’s okay, he can do it. He’s a barber."
"5","Sheldon: He’s not a barber, he’s the nephew. He’s an example of the kind of nepotism that runs rampant in the barbering industry. Besides, Mr. D’Onofrio knows exactly how I like my hair done because he has all my haircut records from my barber in Texas."
"5","Leonard: What are you talking about?"
"5","Sheldon: When I first moved here I was nervous about finding a new barber, so my mother had all my haircut records sent here to Mr. D’Onofrio."
"5","Leonard: There’s no such thing as haircut records."
"5","Sheldon: Yes, there are."
"5","Leonard: Have you ever seen them?"
"5","Sheldon: No, but my mother assured me they were sent here, and I’ll bet you dollars to doughnuts that this one doesn’t have them. Uh, excuse me. Do you have access to my haircut records?"
"5","Barber: Your what?"
"5","Sheldon: To paraphrase T.S. Eliot, this is the way the world ends, not with a bang but with a nephew."
"5","Leonard: Sheldon, you’re a grown man, he’s a professional, and your haircut is number three on that poster from 1946. Just sit down and let him do it."
"5","Sheldon: Fine, but if I come out of this looking like a dork, it’s on you. (Sits)"
"5","Barber: So my kid said the funniest thing today."
"5","Sheldon: Nope. (Runs out)"
"5","Leonard: When you tell this story later, the word we usually use is quirky."
"5","Credits sequence."
"5","Scene: The apartment."
"5","Sheldon: Can you pass the Parmesan cheese?"
"5","Leonard: Sure. What are you doing?"
"5","Sheldon: I’m trying to get the hair out of my eyes."
"5","Leonard: Sheldon, you are one day late for your haircut."
"5","Sheldon: Thank you for captioning my nightmare."
"5","Howard: Lookie here, I got my travel orders."
"5","Raj: Payload Specialist Howard Wolowitz is requested to report to the NASA Johnson Space Center, Houston, Texas, for astronaut training Monday eight a.m."
"5","Howard: Yeah, but it’s from NASA, so it’s oh eight hundred."
"5","Raj: But it says eight a.m."
"5","Howard: You read it as oh eight hundred."
"5","Raj: It doesn’t have an oh in front of it."
"5","Howard: You know what does have an oh in front of it? Oh, my God, I’m an astronaut, and you’re dying of jealousy."
"5","Leonard: So, what kind of things are they… (to Sheldon) will you stop that?"
"5","Sheldon: I can’t help it, I feel like a teen heartthrob."
"5","Penny: You know, Sheldon, I used to cut my brother’s hair. I could do it for you."
"5","Sheldon: Penny, I know you mean well, offering the skills of the hill folk, but, um, here in town we don’t churn our own butter, we don’t, uh, make dresses out of gunny sacks, and, uh, we sure as shootin’ don’t get our hair cut by bottle-blonde…"
"5","Leonard: Sheldon, be nice."
"5","Sheldon: I’m sorry, it’s the bad boy attitude that comes with this hair."
"5","Raj: You could go to my guy. He’s at Juan-Juan in Beverly Hills. They bring you a cup of tea, they’ll massage your scalp. It’s about two hundred dollars, but sometimes you look in the next chair and you see a superstar like Tony Danza."
"5","Howard: Quick question here, have we actually changed the conversation from I’m going"
"5","to astronaut training to Sheldon can’t get a haircut?"
"5","Raj: Now who’s dying of jealousy? Oh, it’s you."
"5","Scene: Amy’s apartment. Amy is playing her harp."
"5","Amy: I’m a cowboy, on a steel horse I ride. I’m wanted… I’m wanted… wanted, dead or alive. Sheldon, you’re ruining girlfriend-boyfriend sing-along night."
"5","Sheldon: I’m sorry. I’m looking for a barber and I’m running out of time. My hair is growing at the rate of 4.6 yoctometers per femtosecond. I mean, if you’re quiet, you can hear it."
"5","Amy: What about Supercuts?"
"5","Sheldon: I tried once. They do men’s and women’s hair in the same room at the same time. It’s like Sodom and Gomorrah with mousse."
"5","Amy: Well, this isn’t a crisis. Why don’t you just let your hair grow out a little?"
"5","Sheldon: Why don’t I let my hair grow out? Um, why don’t I start wearing Birkenstocks and, uh, uh, seeking validation of my opinions by asking can you dig it?"
"5","Amy: Well, I don’t know. I think you might look sexy with long hair. The kind that flows down to your shoulders and blows back while riding on a horse, bareback and bare-chested. I’m gonna go brush my teeth, it might take a while."
"5","Scene: Bernadette’s bedroom."
"5","Howard (on Skype): Hi."
"5","Bernadette: Hi, sweetie."
"5","Howard: I miss you."
"5","Bernadette: I miss you, too. So tell me all about your first day."
"5","Howard: Oh, wow, where do I even start? I got to experience zero gravity."
"5","Bernadette: Cool. How do they do that?"
"5","Howard: It’s pretty neat. You get in this plane that goes almost straight up for, like, 20 seconds, and then straight back down like it’s going to crash, and they do it over and over again, you know, no matter how many times you throw up."
"5","Bernadette: You threw up?"
"5","Howard: Yeah, and the craziest part is, because there’s no gravity, the throw-up kind of floats there, in a little ball, and if your mouth is open because you’re screaming, sometimes it just floats right back in. Boy, does everyone laugh at you when that happens."
"5","Bernadette: That sounds mean."
"5","Howard: No. Yeah, I would have laughed, too, but I didn’t want the vomit to come back out. Anyway, oh, could you do me a favour and overnight me some more underwear?"
"5","Bernadette: Sure, why?"
"5","Howard: I got a look at the centrifuge they’re going to spin me around in tomorrow, and I have a hunch I packed a little light."
"5","Scene: A hospital ward."
"5","Sheldon: Mr. D’Onofrio? It’s Sheldon. They didn’t have anything barber-themed in the gift shop, so I got you this. I don’t know if you can read his little T-shirt. It says, um, get well bear-y soon. Trust me, if you were even a little conscious right now, you’d be laughing. Anyway, there’s new studies that show, people in comas are aware of everything going on around them. With that in mind, if you can hear me, move away from the light and toward the sound of these scissors."
"5","Nurse: Can I help you?"
"5","Sheldon: Yes. Do you have something I could use as a cape?"
"5","Nurse: Oh, dear, did we spit out our pills, slip out of the ninth floor, and go on a little adventure?"
"5","Sheldon: Oh, no, no, I’m just here to get my hair cut."
"5","Nurse: I-I see. J-Jus-Just wait here one moment. Security!"
"5","Sheldon: I got to run. But not with scissors, that would be unsafe."
"5","Penny: So, if I move my horsey here, isn’t that checkmate and I win?"
"5","Leonard: Hmm."
"5","Penny: Well, is it or isn’t it?"
"5","Leonard: You know, I think this is a good stopping point. Uh, it’s your first real game. I threw a lot of information at you."
"5","Penny: Well, no, I mean, your king is trapped. He can’t go here because of my lighthouse, and he can’t go here because of my pointy-head guy."
"5","Leonard: Like I said, complicated game."
"5","Penny: So did I win or not?"
"5","Leonard: Did you have fun? Because if you had fun, then you are, you are a winner. Now that’s, that-that’s what chess is all about."
"5","Sheldon: Hello."
"5","Leonard: Hey."
"5","Penny: Oh, hey. Sorry, Sheldon, I’ll move."
"5","Sheldon: Eh, why? My spot, your spot, what difference does it make?"
"5","Penny: Okay, what just happened?"
"5","Leonard: I don’t know. Between you playing chess like Bobby Fischer and Sheldon being okay with you in his spot, I’m guessing someone went back in time, stepped on a bug, and changed the course of human events."
"5","Penny: Uh, sweetie, are you all right?"
"5","Sheldon: No, I’m not all right. It’s been six days since I was supposed to get a haircut and nothing horrible has happened."
"5","Penny: Okay, I’m sorry, I don’t understand."
"5","Sheldon: Leonard, explain it to her."
"5","Leonard: Oh, uh, he’s crazy."
"5","Sheldon: I have spent my whole life trying to bring order to the universe by carefully planning every moment of every day. But all my efforts, our dinner schedule, my pyjama rotation, my bowel movement spreadsheet, it’s clear now, I’ve been wasting my time."
"5","Leonard: Good. I’m taking that disgusting chart off the fridge."
"5","Penny: You know, Sh-Sheldon, sometimes it’s nice not knowing what’s coming. I mean, look at me and Leonard. We went out, we broke up, now we’re trying again. We don’t know what’s gonna happen."
"5","Sheldon: Oh, please, everyone knows what’s going to happen. But I see your point."
"5","Leonard: I think this could be good for you. Maybe it’s time for you to shake things up a bit."
"5","Sheldon: You’re right. I should embrace the chaos."
"5","Leonard: Great. What are you going to do first?"
"5","Sheldon: I don’t know. I could do anything. All bets are off. The world is my oyster. I got it. I’m going to put on my Tuesday pyjamas tonight."
"5","Leonard: I got to tell you, I’m a little worried about him."
"5","Penny: If I were you, I’d be worried that a girl who’s never played chess in her life just kicked your ass."
"5","Bernadette: Howie, what happened to you?"
"5","Howard: We did overnight survival training in the wilderness. Big fun. Big, big fun. I was gonna freshen up for you but I blacked out a little on the way to the bathroom."
"5","Bernadette: Survival training? Is that like camping?"
"5","Howard: Uh-huh. Except you don’t have food or water, and they don’t have a sunset Sabbath service like they do at Camp Hess-Kramer."
"5","Bernadette: Do you sleep in tents?"
"5","Howard: No. I slept in a hole I dug in the ground with my bare hands. And at some point during the night, an armadillo crawled in and spooned me."
"5","Bernadette: Poor baby."
"5","Howard: But I did it. I survived. I wasn’t sure I was going to when the sandstorm hit. I just pulled my turtleneck up over my head and waited for death. But somehow as I sat there, wrapped in a cocoon of my own neck-sweat, I found that primal part of the human spirit that just wants to keep on living, no matter what the cost."
"5","Bernadette: You’re so brave. I’m proud of you."
"5","Howard: I ate a butterfly. It was so small and beautiful, but I was so hungry."
"5","Bernadette: Are you crying?"
"5","Howard: No, I don’t think it’s possible. I’m severely dehydrated. My pee is like toothpaste."
"5","Bernadette: Howie, if you’re not able to do this, come home. It won’t change how I feel about you."
"5","Howard: Thanks, honey, but I can’t quit. If I do, I’ll just be a guy who had a chance to be an astronaut and gave it up."
"5","Bernadette: Well, is there anything I could do to help?"
"5","Howard: No. Wait. Send more underwear."
"5","Scene: Leonard’s bedroom. Leonard wakes to the sound of bongos."
"5","Leonard (going to living room): Don’t let this be Sheldon playing bongos. Please don’t let this be Sheldon playing bongos."
"5","Sheldon: Hello, Leonard, do you like my bongos? Bet you didn’t know that I had bongos."
"5","Leonard: Sheldon, it’s three o’clock in the morning."
"5","Sheldon: Three in the morning is a good time for bongos."
"5","Leonard: I was sleeping."
"5","Sheldon: Leonard sleeps while I play bongos."
"5","Leonard: No, he doesn’t."
"5","Sheldon: Leonard no sleep while I play bongos. Bongo solo."
"5","Leonard: Stop! Stop it! Stop! Stop! Stop it!"
"5","Penny (entering): What the hell?!"
"5","Leonard: Oh, hi, Penny, guess what? Sheldon got bongos."
"5","Penny: Why did you get bongos?"
"5","Sheldon: Richard Feynman played the bongos. I thought I’d give that a try."
"5","Leonard: Richard Feynman was a famous physicist."
"5","Penny: Oh, Leonard, it’s three o’clock in the morning. I don’t care if Richard Feynman was a purple leprechaun who lived in my butt."
"5","Sheldon: Penny meant if he were a purple leprechaun. Penny forgot to use the subjunctive."
"5","Leonard: Sheldon, go to bed. You have work in the morning."
"5","Sheldon: Maybe, maybe not. Maybe tomorrow I start a bongo band and tour the world."
"5","Leonard: W-w-wuh, no, no, hang on,uh, uh, roommate agreement. No hootenannies, sing-a-longs, or barbershop quartets after ten p.m."
"5","Sheldon: Roommate agreement? Are you kidding? We are living in a world of chaos. Roommate agreement."
"5","Penny: Where are you going?"
"5","Sheldon: Wherever the music takes me, kitten. I play bongos walking down the stairs. (Sound of falling) Oh! Oh! Never play bongos walking down the stairs."
"5","Scene: Howard’s hotel room. There is a knock on the door."
"5","Bernadette: Surprise."
"5","Howard: What are you doing here?"
"5","Bernadette: I’m here to help you get through this. You can’t do it on your own, you need someone to take care of you."
"5","Howard: Oh, I love you so much."
"5","Bernadette: Oh, I love you."
"5","Mrs Wolowitz (off): Howard, your bath is getting cold!"
"5","Howard: Don’t worry, once she falls asleep, I’ll spoon you like an armadillo."
"5","Scene: Amy’s apartment."
"5","Amy: He showed up in the middle of the night with his bongos. I foolishly thought it was some sort of musical booty call."
"5","Leonard: Poor guy. He must have been exhausted. Sheldon like to sleep while Leonard play the bongo!"
"5","Amy: That was kind of uncalled for."
"5","Leonard: No, it was called for."
"5","Sheldon: What’s going on?"
"5","Penny: All right, Sheldon, this craziness has gone on long enough. Please come home so I can cut your hair."
"5","Sheldon: Penny, you’re not trained. You’re not licensed. Most importantly, you don’t have access to my haircut records."
"5","Penny: All right, honey, look, we’ve known each other for a long time now, right? I’ve taken you to Disneyland, I kicked a bully in the nuts for you, I sing you Soft Kitty when you’re sick, you’ve even saw me naked once."
"5","Leonard: I’m sorry, duh, what?"
"5","Penny: It was a long story. Anyway, Sheldon, I promise I know what I’m doing. Please let me cut your hair."
"5","Sheldon: Amy, what do you think?"
"5","Amy: There’s not a hair on my body I wouldn’t let this woman trim."
"5","Sheldon: Fine, let’s go. Thank you for letting me sleep on your couch."
"5","Amy: There’s only so many times a woman can say how about the bed?"
"5","Leonard: What’s this about Sheldon seeing you naked?"
"5","Sheldon: Oh, relax. It was just her bottom and her breasts."
"5","Scene: Penny’s apartment. Penny is cutting Sheldon’s hair."
"5","Penny: Almost done."
"5","Sheldon: At the end of the haircut, Mr. D’Onofrio would tell me a dirty joke."
"5","Penny: Well, sorry, I don’t know any dirty jokes."
"5","Sheldon: That’s okay, I never understood them anyway."
"5","Penny: Okay, what do you think?"
"5","Sheldon: Hmm, well, it’s a little Hollywood. But I think I can pull it off. Well done, Penny."
"5","Penny: Ha, told you. Okay, I’m just gonna clean up your neck a little and then you are good to go."
"5","Sheldon: Fun time. Hah. Sorry, sometimes the clippers tickle me."
"5","Penny: Okay. (Sheldon laughs and jerks, Penny accidentally shaves a strip up the back of his head) Okay, yep, we’re all done now. It’s just, it’s good. Let me just take that away from you. Okay."
"5","Sgeldon: Thank you very much."
"5","Penny: You are welcome. Yeah, I’m gonna have to move."
"5","Series 05 Episode 19 – The Weekend Vortex"
"5","Scene: The stairwell"
"5","Raj: Hey, want to spend some time playing the new Star Wars game this weekend?"
"5","Leonard: Oh, I don’t know. I kind of promised myself I’d get off the computer, be more physically active. Get some exercise."
"5","Howard: You’re about to walk up three flights of stairs."
"5","Leonard: Good point, I’m in."
"5","Raj: You know what would be great? Let’s do it like the old days."
"5","Leonard: You mean, are you talking gaming marathon?"
"5","Raj: Yeah. Start Saturday morning, go 48 hours, sleeping bags, junk food."
"5","Howard: Turn off our phones so our moms can’t call."
"5","Leonard: It would be like our World Of Warcraft a few years ago when the neighbours called the cops on us."
"5","Howard: They called the cops because of the smell. They thought we were dead."
"5","Raj: We were badass back in the day."
"5","Leonard: All right, let’s do it."
"5","Howard: 48 hours of Star Wars gaming."
"5","Raj: It’s on like Alderaan."
"5","Leonard: Hey, Sheldon, clear your weekend. Starting Saturday morning, Star Wars< marathon"
"5","Raj: Woo-hoo!"
"5","Sheldon: Movies or video games? Or board game? Or trading card games? Or Lego’s? Or dress up? Or comic books? Or dramatic readings of novelizations? Yes to all!"
"5","Leonard: We are going to play the online game."
"5","Sheldon: The online game? Bully!"
"5","Amy: Gentlemen, as much as I’m sure Sheldon would enjoy playing intergalactic make-believe, he and I have other plans. We are attending my Aunt Flora’s 93rd birthday party."
"5","Sheldon: Just tell her I can’t come."
"5","Amy: She’ll be disappointed if we don’t show up."
"5","Sheldon: She’s 93. She won’t be disappointed for very long."
